5415,GO:0008628,hormone-mediated apoptotic signaling pathway
5416,GO:0045124,regulation of bone resorption
5417,GO:0045794,negative regulation of cell volume
5418,GO:1903301,positive regulation of hexokinase activity
5419,GO:0048313,Golgi inheritance
5420,GO:0060348,bone development
5421,GO:2000179,positive regulation of neural precursor cell proliferation
5422,GO:0014728,regulation of the force of skeletal muscle contraction
5423,GO:0097061,dendritic spine organization
5424,GO:0061180,mammary gland epithelium development
5425,GO:0061188,negative regulation of chromatin silencing at rDNA
5426,GO:0034754,cellular hormone metabolic process
5427,GO:0051645,Golgi localization
5428,GO:0060075,regulation of resting membrane potential
5429,GO:0070229,negative regulation of lymphocyte apoptotic process
5430,GO:0070640,vitamin D3 metabolic process
5431,GO:1901565,organonitrogen compound catabolic process
5432,GO:0034614,cellular response to reactive oxygen species
5433,GO:0021847,ventricular zone neuroblast division
5434,GO:0048342,paraxial mesodermal cell differentiation
5435,GO:0007015,actin filament organization
5436,GO:0032464,positive regulation of protein homooligomerization
5437,GO:1901355,response to rapamycin
5438,GO:0006412,translation
5439,GO:0035483,gastric emptying
5440,GO:1901534,positive regulation of hematopoietic progenitor cell differentiation
5441,GO:0000960,regulation of mitochondrial RNA catabolic process
5442,GO:0050873,brown fat cell differentiation
5443,GO:0031591,wybutosine biosynthetic process
5444,GO:1903677,regulation of cap-independent translational initiation
5445,GO:0032760,positive regulation of tumor necrosis factor production
5446,GO:0097352,autophagosome maturation
5447,GO:0031111,negative regulation of microtubule polymerization or depolymerization
5448,GO:0007227,signal transduction downstream of smoothened
5449,GO:0016107,sesquiterpenoid catabolic process
5450,GO:1904884,positive regulation of telomerase catalytic core complex assembly
5451,GO:0015959,diadenosine polyphosphate metabolic process
5452,GO:0007405,neuroblast proliferation
5453,GO:0006939,smooth muscle contraction
5454,GO:0032790,ribosome disassembly
5455,GO:0090307,mitotic spindle assembly
5456,GO:0031058,positive regulation of histone modification
5457,GO:1904023,regulation of glucose catabolic process to lactate via pyruvate
5458,GO:0060435,bronchiole development
5459,GO:0030825,positive regulation of cGMP metabolic process
5460,GO:0002501,peptide antigen assembly with MHC protein complex
5461,GO:0042045,epithelial fluid transport
5462,GO:0048213,Golgi vesicle prefusion complex stabilization
5463,GO:0060442,branching involved in prostate gland morphogenesis
5464,GO:0044801,single-organism membrane fusion
5465,GO:1903365,regulation of fear response
5466,GO:0021756,striatum development
5467,GO:0010421,hydrogen peroxide-mediated programmed cell death
5468,GO:1902774,late endosome to lysosome transport
5469,GO:0021888,hypothalamus gonadotrophin-releasing hormone neuron development
5470,GO:1902732,positive regulation of chondrocyte proliferation
5471,GO:0086064,cell communication by electrical coupling involved in cardiac conduction
5472,GO:2000668,regulation of dendritic cell apoptotic process
5473,GO:0097341,zymogen inhibition
5474,GO:0006338,chromatin remodeling
5475,GO:0042264,peptidyl-aspartic acid hydroxylation
5476,GO:0019058,viral life cycle
5477,GO:0010989,negative regulation of low-density lipoprotein particle clearance
5478,GO:0019693,ribose phosphate metabolic process
5479,GO:0060266,negative regulation of respiratory burst involved in inflammatory response
5480,GO:0030327,prenylated protein catabolic process
5481,GO:0034379,very-low-density lipoprotein particle assembly
5482,GO:0042490,mechanoreceptor differentiation
5483,GO:0090025,regulation of monocyte chemotaxis
5484,GO:1902993,positive regulation of amyloid precursor protein catabolic process
5485,GO:0070814,hydrogen sulfide biosynthetic process
5486,GO:0042420,dopamine catabolic process
5487,GO:2000366,positive regulation of STAT protein import into nucleus
5488,GO:0045061,thymic T cell selection
5489,GO:0019934,cGMP-mediated signaling
5490,GO:0030520,intracellular estrogen receptor signaling pathway
5491,GO:0060340,positive regulation of type I interferon-mediated signaling pathway
5492,GO:0016267,O-glycan processing, core 1
5493,GO:1903798,regulation of production of miRNAs involved in gene silencing by miRNA
5494,GO:1902943,positive regulation of voltage-gated chloride channel activity
5495,GO:0045578,negative regulation of B cell differentiation
5496,GO:0070193,synaptonemal complex organization
5497,GO:0006564,L-serine biosynthetic process
5498,GO:0030186,melatonin metabolic process
5499,GO:1903525,regulation of membrane tubulation
5500,GO:0061641,CENP-A containing chromatin organization
5501,GO:0048867,stem cell fate determination
5502,GO:0045815,positive regulation of gene expression, epigenetic
5503,GO:0043523,regulation of neuron apoptotic process
5504,GO:0072109,glomerular mesangium development
5505,GO:1901421,positive regulation of response to alcohol
5506,GO:0051412,response to corticosterone
5507,GO:0097178,ruffle assembly
5508,GO:0072161,mesenchymal cell differentiation involved in kidney development
5509,GO:0006927,transformed cell apoptotic process
5510,GO:1903010,regulation of bone development
5511,GO:0043535,regulation of blood vessel endothelial cell migration
5512,GO:0007440,foregut morphogenesis
5513,GO:0042095,interferon-gamma biosynthetic process
5514,GO:0007131,reciprocal meiotic recombination
5515,GO:0019318,hexose metabolic process
5516,GO:0071396,cellular response to lipid
5517,GO:0070124,mitochondrial translational initiation
5518,GO:2000253,positive regulation of feeding behavior
5519,GO:0051189,prosthetic group metabolic process
5520,GO:0045761,regulation of adenylate cyclase activity
5521,GO:0001508,action potential
5522,GO:0035563,positive regulation of chromatin binding
5523,GO:0060168,positive regulation of adenosine receptor signaling pathway
5524,GO:0010996,response to auditory stimulus
5525,GO:0009394,2'-deoxyribonucleotide metabolic process
5526,GO:0051588,regulation of neurotransmitter transport
5527,GO:0014736,negative regulation of muscle atrophy
5528,GO:0090335,regulation of brown fat cell differentiation
5529,GO:0001696,gastric acid secretion
5530,GO:0097588,archaeal or bacterial-type flagellum-dependent cell motility
5531,GO:0010324,membrane invagination
5532,GO:1902990,mitotic telomere maintenance via semi-conservative replication
5533,GO:0042438,melanin biosynthetic process
5534,GO:0003331,positive regulation of extracellular matrix constituent secretion
5535,GO:0070886,positive regulation of calcineurin-NFAT signaling cascade
5536,GO:0034970,histone H3-R2 methylation
5537,GO:0045992,negative regulation of embryonic development
5538,GO:0098661,inorganic anion transmembrane transport
5539,GO:0021886,hypothalamus gonadotrophin-releasing hormone neuron differentiation
5540,GO:1903751,negative regulation of intrinsic apoptotic signaling pathway in response to hydrogen peroxide
5541,GO:0007093,mitotic cell cycle checkpoint
5542,GO:0019935,cyclic-nucleotide-mediated signaling
5543,GO:0052405,negative regulation by host of symbiont molecular function
5544,GO:0050917,sensory perception of umami taste
5545,GO:0070781,response to biotin
5546,GO:0030917,midbrain-hindbrain boundary development
5547,GO:0016338,calcium-independent cell-cell adhesion via plasma membrane cell-adhesion molecules
5548,GO:0070970,interleukin-2 secretion
5549,GO:0009447,putrescine catabolic process
5550,GO:0002890,negative regulation of immunoglobulin mediated immune response
5551,GO:0019100,male germ-line sex determination
5552,GO:0060438,trachea development
5553,GO:0042197,halogenated hydrocarbon metabolic process
5554,GO:0015871,choline transport
5555,GO:1904667,negative regulation of ubiquitin protein ligase activity
5556,GO:0007268,synaptic transmission
5557,GO:0090249,regulation of cell motility involved in somitogenic axis elongation
5558,GO:2000532,regulation of renal albumin absorption
5559,GO:1903608,protein localization to cytoplasmic stress granule
5560,GO:0060479,lung cell differentiation
5561,GO:0043300,regulation of leukocyte degranulation
5562,GO:1904888,cranial skeletal system development
5563,GO:0045954,positive regulation of natural killer cell mediated cytotoxicity
5564,GO:0071265,L-methionine biosynthetic process
5565,GO:0086013,membrane repolarization during cardiac muscle cell action potential
5566,GO:0030198,extracellular matrix organization
5567,GO:0035414,negative regulation of catenin import into nucleus
5568,GO:0010888,negative regulation of lipid storage
5569,GO:0061351,neural precursor cell proliferation
5570,GO:0090260,negative regulation of retinal ganglion cell axon guidance
5571,GO:0003356,regulation of cilium beat frequency
5572,GO:0042278,purine nucleoside metabolic process
5573,GO:1901419,regulation of response to alcohol
5574,GO:0009794,regulation of mitotic cell cycle, embryonic
5575,GO:0061368,behavioral response to formalin induced pain
5576,GO:0072235,metanephric distal tubule development
5577,GO:0052314,phytoalexin metabolic process
5578,GO:0003284,septum primum development
5579,GO:1900127,positive regulation of hyaluronan biosynthetic process
5580,GO:1904468,negative regulation of tumor necrosis factor secretion
5581,GO:0090314,positive regulation of protein targeting to membrane
5582,GO:0007185,transmembrane receptor protein tyrosine phosphatase signaling pathway
5583,GO:0001736,establishment of planar polarity
5584,GO:0003171,atrioventricular valve development
5585,GO:0060161,positive regulation of dopamine receptor signaling pathway
5586,GO:0034332,adherens junction organization
5587,GO:0033628,regulation of cell adhesion mediated by integrin
5588,GO:0072199,regulation of mesenchymal cell proliferation involved in ureter development
5589,GO:0098901,regulation of cardiac muscle cell action potential
5590,GO:0046487,glyoxylate metabolic process
5591,GO:0007520,myoblast fusion
5592,GO:0046641,positive regulation of alpha-beta T cell proliferation
5593,GO:0097332,response to antipsychotic drug
5594,GO:0045039,protein import into mitochondrial inner membrane
5595,GO:0044650,adhesion of symbiont to host cell
5596,GO:0019511,peptidyl-proline hydroxylation
5597,GO:0046543,development of secondary female sexual characteristics
5598,GO:0030264,nuclear fragmentation involved in apoptotic nuclear change
5599,GO:0090149,mitochondrial membrane fission
5600,GO:0046512,sphingosine biosynthetic process
5601,GO:1903204,negative regulation of oxidative stress-induced neuron death
5602,GO:2000468,regulation of peroxidase activity
5603,GO:0003406,retinal pigment epithelium development
5604,GO:2000249,regulation of actin cytoskeleton reorganization
5605,GO:0060795,cell fate commitment involved in formation of primary germ layer
5606,GO:0001964,startle response
5607,GO:0090287,regulation of cellular response to growth factor stimulus
5608,GO:1901246,regulation of lung ciliated cell differentiation
5609,GO:0060762,regulation of branching involved in mammary gland duct morphogenesis
5610,GO:0006528,asparagine metabolic process
5611,GO:0048260,positive regulation of receptor-mediated endocytosis
5612,GO:0009236,cobalamin biosynthetic process
5613,GO:0031646,positive regulation of neurological system process
5614,GO:0006477,protein sulfation
5615,GO:0030423,targeting of mRNA for destruction involved in RNA interference
5616,GO:0030200,heparan sulfate proteoglycan catabolic process
5617,GO:0061669,spontaneous neurotransmitter secretion
5618,GO:1902284,neuron projection extension involved in neuron projection guidance
5619,GO:0001781,neutrophil apoptotic process
5620,GO:0046850,regulation of bone remodeling
5621,GO:0015849,organic acid transport
5622,GO:0061052,negative regulation of cell growth involved in cardiac muscle cell development
5623,GO:0051656,establishment of organelle localization
5624,GO:0014063,negative regulation of serotonin secretion
5625,GO:0008631,intrinsic apoptotic signaling pathway in response to oxidative stress
5626,GO:0033273,response to vitamin
5627,GO:0033564,anterior/posterior axon guidance
5628,GO:0035264,multicellular organism growth
5629,GO:1903867,extraembryonic membrane development
5630,GO:0048662,negative regulation of smooth muscle cell proliferation
5631,GO:0097240,chromosome attachment to the nuclear envelope
5632,GO:0010459,negative regulation of heart rate
5633,GO:0048799,organ maturation
5634,GO:0070588,calcium ion transmembrane transport
5635,GO:0060086,circadian temperature homeostasis
5636,GO:0014010,Schwann cell proliferation
5637,GO:0035521,monoubiquitinated histone deubiquitination
5638,GO:0098542,defense response to other organism
5639,GO:0032680,regulation of tumor necrosis factor production
5640,GO:0060839,endothelial cell fate commitment
5641,GO:0046960,sensitization
5642,GO:0071878,negative regulation of adrenergic receptor signaling pathway
5643,GO:0018243,protein O-linked glycosylation via threonine
5644,GO:0042780,tRNA 3'-end processing
5645,GO:1903897,regulation of PERK-mediated unfolded protein response
5646,GO:0000724,double-strand break repair via homologous recombination
5647,GO:1902952,positive regulation of dendritic spine maintenance
5648,GO:0072053,renal inner medulla development
5649,GO:0052695,cellular glucuronidation
5650,GO:0007077,mitotic nuclear envelope disassembly
5651,GO:0072512,trivalent inorganic cation transport
5652,GO:0043416,regulation of skeletal muscle tissue regeneration
5653,GO:0070099,regulation of chemokine-mediated signaling pathway
5654,GO:0051828,entry into other organism involved in symbiotic interaction
5655,GO:1903358,regulation of Golgi organization
5656,GO:0042094,interleukin-2 biosynthetic process
5657,GO:0070922,small RNA loading onto RISC
5658,GO:0050653,chondroitin sulfate proteoglycan biosynthetic process, polysaccharide chain biosynthetic process
5659,GO:0009067,aspartate family amino acid biosynthetic process
5660,GO:0070813,hydrogen sulfide metabolic process
5661,GO:1903265,positive regulation of tumor necrosis factor-mediated signaling pathway
5662,GO:1903215,negative regulation of protein targeting to mitochondrion
5663,GO:1901214,regulation of neuron death
5664,GO:1901895,negative regulation of calcium-transporting ATPase activity
5665,GO:0008340,determination of adult lifespan
5666,GO:0071158,positive regulation of cell cycle arrest
5667,GO:0016024,CDP-diacylglycerol biosynthetic process
5668,GO:0038007,netrin-activated signaling pathway
5669,GO:0019430,removal of superoxide radicals
5670,GO:0044003,modification by symbiont of host morphology or physiology
5671,GO:0051176,positive regulation of sulfur metabolic process
5672,GO:0034101,erythrocyte homeostasis
5673,GO:0090258,negative regulation of mitochondrial fission
5674,GO:0002765,immune response-inhibiting signal transduction
5675,GO:0019884,antigen processing and presentation of exogenous antigen
5676,GO:0006344,maintenance of chromatin silencing
5677,GO:0048708,astrocyte differentiation
5678,GO:0007017,microtubule-based process
5679,GO:0000350,generation of catalytic spliceosome for second transesterification step
5680,GO:0071500,cellular response to nitrosative stress
5681,GO:0060481,lobar bronchus epithelium development
5682,GO:0010613,positive regulation of cardiac muscle hypertrophy
5683,GO:0021999,neural plate anterior/posterior regionalization
5684,GO:0043372,positive regulation of CD4-positive, alpha-beta T cell differentiation
5685,GO:0044257,cellular protein catabolic process
5686,GO:0035910,ascending aorta morphogenesis
5687,GO:0044550,secondary metabolite biosynthetic process
5688,GO:0015670,carbon dioxide transport
5689,GO:1904382,mannose trimming involved in glycoprotein ERAD pathway
5690,GO:0050803,regulation of synapse structure or activity
5691,GO:0036293,response to decreased oxygen levels
5692,GO:0060368,regulation of Fc receptor mediated stimulatory signaling pathway
5693,GO:0030320,cellular monovalent inorganic anion homeostasis
5694,GO:2001280,positive regulation of unsaturated fatty acid biosynthetic process
5695,GO:0006546,glycine catabolic process
5696,GO:0060152,microtubule-based peroxisome localization
5697,GO:0031114,regulation of microtubule depolymerization
5698,GO:0042700,luteinizing hormone signaling pathway
5699,GO:0071257,cellular response to electrical stimulus
5700,GO:0033555,multicellular organismal response to stress
5701,GO:0009133,nucleoside diphosphate biosynthetic process
5702,GO:1904636,response to ionomycin
5703,GO:0001656,metanephros development
5704,GO:2001183,negative regulation of interleukin-12 secretion
5705,GO:0018199,peptidyl-glutamine modification
5706,GO:0048678,response to axon injury
5707,GO:0042752,regulation of circadian rhythm
5708,GO:0048873,homeostasis of number of cells within a tissue
5709,GO:0036309,protein localization to M-band
5710,GO:0032653,regulation of interleukin-10 production
5711,GO:0015838,amino-acid betaine transport
5712,GO:0006886,intracellular protein transport
5713,GO:1903689,regulation of wound healing, spreading of epidermal cells
5714,GO:0055092,sterol homeostasis
5715,GO:1902232,regulation of positive thymic T cell selection
5716,GO:0042747,circadian sleep/wake cycle, REM sleep
5717,GO:0015909,long-chain fatty acid transport
5718,GO:0030449,regulation of complement activation
5719,GO:0034196,acylglycerol transport
5720,GO:0006801,superoxide metabolic process
5721,GO:0060179,male mating behavior
5722,GO:1903061,positive regulation of protein lipidation
5723,GO:0060405,regulation of penile erection
5724,GO:1901990,regulation of mitotic cell cycle phase transition
5725,GO:0033598,mammary gland epithelial cell proliferation
5726,GO:1902227,negative regulation of macrophage colony-stimulating factor signaling pathway
5727,GO:0009115,xanthine catabolic process
5728,GO:0045444,fat cell differentiation
5729,GO:0000966,RNA 5'-end processing
5730,GO:0007216,G-protein coupled glutamate receptor signaling pathway
5731,GO:0018146,keratan sulfate biosynthetic process
5732,GO:0008214,protein dealkylation
5733,GO:0009129,pyrimidine nucleoside monophosphate metabolic process
5734,GO:0086069,bundle of His cell to Purkinje myocyte communication
5735,GO:0035745,T-helper 2 cell cytokine production
5736,GO:0072576,liver morphogenesis
5737,GO:0045919,positive regulation of cytolysis
5738,GO:2001202,negative regulation of transforming growth factor-beta secretion
5739,GO:1902594,multi-organism nuclear import
5740,GO:0061370,testosterone biosynthetic process
5741,GO:0036023,embryonic skeletal limb joint morphogenesis
5742,GO:0021871,forebrain regionalization
5743,GO:0006505,GPI anchor metabolic process
5744,GO:0006574,valine catabolic process
5745,GO:0034093,positive regulation of maintenance of sister chromatid cohesion
5746,GO:0048203,vesicle targeting, trans-Golgi to endosome
5747,GO:2000147,positive regulation of cell motility
5748,GO:1904059,regulation of locomotor rhythm
5749,GO:0035026,leading edge cell differentiation
5750,GO:0009143,nucleoside triphosphate catabolic process
5751,GO:0006423,cysteinyl-tRNA aminoacylation
5752,GO:0060060,post-embryonic retina morphogenesis in camera-type eye
5753,GO:0021513,spinal cord dorsal/ventral patterning
5754,GO:0060977,coronary vasculature morphogenesis
5755,GO:0009438,methylglyoxal metabolic process
5756,GO:0042100,B cell proliferation
5757,GO:0097480,establishment of synaptic vesicle localization
5758,GO:0051603,proteolysis involved in cellular protein catabolic process
5759,GO:1904467,regulation of tumor necrosis factor secretion
5760,GO:0061430,bone trabecula morphogenesis
5761,GO:0071623,negative regulation of granulocyte chemotaxis
5762,GO:1903375,facioacoustic ganglion development
5763,GO:0043009,chordate embryonic development
5764,GO:0051403,stress-activated MAPK cascade
5765,GO:0016056,rhodopsin mediated signaling pathway
5766,GO:0034476,U5 snRNA 3'-end processing
5767,GO:0002294,CD4-positive, alpha-beta T cell differentiation involved in immune response
5768,GO:0060559,positive regulation of calcidiol 1-monooxygenase activity
5769,GO:0034123,positive regulation of toll-like receptor signaling pathway
5770,GO:2000463,positive regulation of excitatory postsynaptic potential
5771,GO:0002553,histamine secretion by mast cell
5772,GO:0001778,plasma membrane repair
5773,GO:0070092,regulation of glucagon secretion
5774,GO:0072098,anterior/posterior pattern specification involved in kidney development
5775,GO:0031958,corticosteroid receptor signaling pathway
5776,GO:0097368,establishment of Sertoli cell barrier
5777,GO:0032305,positive regulation of icosanoid secretion
5778,GO:1904058,positive regulation of sensory perception of pain
5779,GO:1901624,negative regulation of lymphocyte chemotaxis
5780,GO:0031498,chromatin disassembly
5781,GO:0010712,regulation of collagen metabolic process
5782,GO:1902219,negative regulation of intrinsic apoptotic signaling pathway in response to osmotic stress
5783,GO:0060685,regulation of prostatic bud formation
5784,GO:0043117,positive regulation of vascular permeability
5785,GO:1902966,positive regulation of protein localization to early endosome
5786,GO:0016337,single organismal cell-cell adhesion
5787,GO:0034224,cellular response to zinc ion starvation
5788,GO:0046066,dGDP metabolic process
5789,GO:0033089,positive regulation of T cell differentiation in thymus
5790,GO:0021795,cerebral cortex cell migration
5791,GO:0002455,humoral immune response mediated by circulating immunoglobulin
5792,GO:0038086,VEGF-activated platelet-derived growth factor receptor signaling pathway
5793,GO:0031268,pseudopodium organization
5794,GO:0007628,adult walking behavior
5795,GO:1903753,negative regulation of p38MAPK cascade
5796,GO:0032387,negative regulation of intracellular transport
5797,GO:0007638,mechanosensory behavior
5798,GO:0042168,heme metabolic process
5799,GO:0035356,cellular triglyceride homeostasis
5800,GO:0097340,inhibition of cysteine-type endopeptidase activity
5801,GO:1903626,positive regulation of DNA catabolic process
5802,GO:0006968,cellular defense response
5803,GO:0060562,epithelial tube morphogenesis
5804,GO:0070350,regulation of white fat cell proliferation
5805,GO:0032526,response to retinoic acid
5806,GO:0035608,protein deglutamylation
5807,GO:0032096,negative regulation of response to food
5808,GO:0015677,copper ion import
5809,GO:0060040,retinal bipolar neuron differentiation
5810,GO:0060372,regulation of atrial cardiac muscle cell membrane repolarization
5811,GO:0043241,protein complex disassembly
5812,GO:0042475,odontogenesis of dentin-containing tooth
5813,GO:0048205,COPI coating of Golgi vesicle
5814,GO:1902806,regulation of cell cycle G1/S phase transition
5815,GO:0048608,reproductive structure development
5816,GO:0007289,spermatid nucleus differentiation
5817,GO:0042262,DNA protection
5818,GO:0021893,cerebral cortex GABAergic interneuron fate commitment
5819,GO:0009151,purine deoxyribonucleotide metabolic process
5820,GO:1900452,regulation of long term synaptic depression
5821,GO:0021843,substrate-independent telencephalic tangential interneuron migration
5822,GO:0006867,asparagine transport
5823,GO:1903487,regulation of lactation
5824,GO:2001225,regulation of chloride transport
5825,GO:0014056,regulation of acetylcholine secretion, neurotransmission
5826,GO:0034472,snRNA 3'-end processing
5827,GO:0030041,actin filament polymerization
5828,GO:0002534,cytokine production involved in inflammatory response
5829,GO:0006772,thiamine metabolic process
5830,GO:0090596,sensory organ morphogenesis
5831,GO:0006015,5-phosphoribose 1-diphosphate biosynthetic process
5832,GO:0045013,carbon catabolite repression of transcription
5833,GO:0007422,peripheral nervous system development
5834,GO:0036066,protein O-linked fucosylation
5835,GO:1900212,negative regulation of mesenchymal cell apoptotic process involved in metanephros development
5836,GO:1903895,negative regulation of IRE1-mediated unfolded protein response
5837,GO:0009169,purine ribonucleoside monophosphate catabolic process
5838,GO:0071168,protein localization to chromatin
5839,GO:1902222,erythrose 4-phosphate/phosphoenolpyruvate family amino acid catabolic process
5840,GO:0072138,mesenchymal cell proliferation involved in ureteric bud development
5841,GO:0000060,protein import into nucleus, translocation
5842,GO:0014806,smooth muscle hyperplasia
5843,GO:0035711,T-helper 1 cell activation
5844,GO:0010694,positive regulation of alkaline phosphatase activity
5845,GO:0006658,phosphatidylserine metabolic process
5846,GO:1904816,positive regulation of protein localization to chromosome, telomeric region
5847,GO:0010165,response to X-ray
5848,GO:0048646,anatomical structure formation involved in morphogenesis
5849,GO:0032291,axon ensheathment in central nervous system
5850,GO:0003151,outflow tract morphogenesis
5851,GO:0033120,positive regulation of RNA splicing
5852,GO:0072278,metanephric comma-shaped body morphogenesis
5853,GO:1901033,positive regulation of response to reactive oxygen species
5854,GO:0050848,regulation of calcium-mediated signaling
5855,GO:0097212,lysosomal membrane organization
5856,GO:0071501,cellular response to sterol depletion
5857,GO:0033135,regulation of peptidyl-serine phosphorylation
5858,GO:0030821,negative regulation of cAMP catabolic process
5859,GO:0031087,deadenylation-independent decapping of nuclear-transcribed mRNA
5860,GO:0060024,rhythmic synaptic transmission
5861,GO:0010979,regulation of vitamin D 24-hydroxylase activity
5862,GO:0035269,protein O-linked mannosylation
5863,GO:0006783,heme biosynthetic process
5864,GO:0045188,regulation of circadian sleep/wake cycle, non-REM sleep
5865,GO:0030818,negative regulation of cAMP biosynthetic process
5866,GO:0010359,regulation of anion channel activity
5867,GO:0009211,pyrimidine deoxyribonucleoside triphosphate metabolic process
5868,GO:0046218,indolalkylamine catabolic process
