2708,GO:0090071,negative regulation of ribosome biogenesis
2709,GO:0033865,nucleoside bisphosphate metabolic process
2710,GO:0060425,lung morphogenesis
2711,GO:0006878,cellular copper ion homeostasis
2712,GO:0070129,regulation of mitochondrial translation
2713,GO:0010863,positive regulation of phospholipase C activity
2714,GO:0006188,IMP biosynthetic process
2715,GO:0061083,regulation of protein refolding
2716,GO:0035633,maintenance of blood-brain barrier
2717,GO:1901727,positive regulation of histone deacetylase activity
2718,GO:0050666,regulation of homocysteine metabolic process
2719,GO:1904808,positive regulation of protein oxidation
2720,GO:0042760,very long-chain fatty acid catabolic process
2721,GO:0033864,positive regulation of NAD(P)H oxidase activity
2722,GO:0007219,Notch signaling pathway
2723,GO:0090151,establishment of protein localization to mitochondrial membrane
2724,GO:0060056,mammary gland involution
2725,GO:0061548,ganglion development
2726,GO:0051138,positive regulation of NK T cell differentiation
2727,GO:0072172,mesonephric tubule formation
2728,GO:0090160,Golgi to lysosome transport
2729,GO:0031664,regulation of lipopolysaccharide-mediated signaling pathway
2730,GO:0007386,compartment pattern specification
2731,GO:1903208,negative regulation of hydrogen peroxide-induced neuron death
2732,GO:0009263,deoxyribonucleotide biosynthetic process
2733,GO:0060713,labyrinthine layer morphogenesis
2734,GO:0061303,cornea development in camera-type eye
2735,GO:0061008,hepaticobiliary system development
2736,GO:0002408,myeloid dendritic cell chemotaxis
2737,GO:1903530,regulation of secretion by cell
2738,GO:0005997,xylulose metabolic process
2739,GO:0051965,positive regulation of synapse assembly
2740,GO:0033686,positive regulation of luteinizing hormone secretion
2741,GO:0048246,macrophage chemotaxis
2742,GO:0045415,negative regulation of interleukin-8 biosynthetic process
2743,GO:0003344,pericardium morphogenesis
2744,GO:0042078,germ-line stem cell division
2745,GO:0031665,negative regulation of lipopolysaccharide-mediated signaling pathway
2746,GO:0010918,positive regulation of mitochondrial membrane potential
2747,GO:0003093,regulation of glomerular filtration
2748,GO:0051569,regulation of histone H3-K4 methylation
2749,GO:1900120,regulation of receptor binding
2750,GO:2001188,regulation of T cell activation via T cell receptor contact with antigen bound to MHC molecule on antigen presenting cell
2751,GO:0048293,regulation of isotype switching to IgE isotypes
2752,GO:0010714,positive regulation of collagen metabolic process
2753,GO:0075733,intracellular transport of virus
2754,GO:0043981,histone H4-K5 acetylation
2755,GO:0035929,steroid hormone secretion
2756,GO:0006682,galactosylceramide biosynthetic process
2757,GO:0006901,vesicle coating
2758,GO:0097028,dendritic cell differentiation
2759,GO:0038096,Fc-gamma receptor signaling pathway involved in phagocytosis
2760,GO:0001705,ectoderm formation
2761,GO:0048534,hematopoietic or lymphoid organ development
2762,GO:0009880,embryonic pattern specification
2763,GO:1901533,negative regulation of hematopoietic progenitor cell differentiation
2764,GO:0055091,phospholipid homeostasis
2765,GO:0045608,negative regulation of auditory receptor cell differentiation
2766,GO:0042634,regulation of hair cycle
2767,GO:1903288,positive regulation of potassium ion import
2768,GO:1902081,negative regulation of calcium ion import into sarcoplasmic reticulum
2769,GO:0043465,regulation of fermentation
2770,GO:0035385,Roundabout signaling pathway
2771,GO:0007064,mitotic sister chromatid cohesion
2772,GO:0070936,protein K48-linked ubiquitination
2773,GO:0046784,viral mRNA export from host cell nucleus
2774,GO:0010817,regulation of hormone levels
2775,GO:0021543,pallium development
2776,GO:0000079,regulation of cyclin-dependent protein serine/threonine kinase activity
2777,GO:0044107,cellular alcohol metabolic process
2778,GO:0045682,regulation of epidermis development
2779,GO:0038203,TORC2 signaling
2780,GO:0002209,behavioral defense response
2781,GO:2000584,negative regulation of platelet-derived growth factor receptor-alpha signaling pathway
2782,GO:0060385,axonogenesis involved in innervation
2783,GO:0030002,cellular anion homeostasis
2784,GO:0033631,cell-cell adhesion mediated by integrin
2785,GO:0019217,regulation of fatty acid metabolic process
2786,GO:2001275,positive regulation of glucose import in response to insulin stimulus
2787,GO:0010757,negative regulation of plasminogen activation
2788,GO:0009144,purine nucleoside triphosphate metabolic process
2789,GO:0016082,synaptic vesicle priming
2790,GO:0060180,female mating behavior
2791,GO:0098759,cellular response to interleukin-8
2792,GO:0045445,myoblast differentiation
2793,GO:0035283,central nervous system segmentation
2794,GO:0009112,nucleobase metabolic process
2795,GO:0021826,substrate-independent telencephalic tangential migration
2796,GO:0048387,negative regulation of retinoic acid receptor signaling pathway
2797,GO:1902263,apoptotic process involved in embryonic digit morphogenesis
2798,GO:1904396,regulation of neuromuscular junction development
2799,GO:0072575,epithelial cell proliferation involved in liver morphogenesis
2800,GO:0060480,lung goblet cell differentiation
2801,GO:0070163,regulation of adiponectin secretion
2802,GO:0061181,regulation of chondrocyte development
2803,GO:1902117,positive regulation of organelle assembly
2804,GO:0044036,cell wall macromolecule metabolic process
2805,GO:0007156,homophilic cell adhesion via plasma membrane adhesion molecules
2806,GO:0045763,negative regulation of cellular amino acid metabolic process
2807,GO:0072498,embryonic skeletal joint development
2808,GO:0060844,arterial endothelial cell fate commitment
2809,GO:0006555,methionine metabolic process
2810,GO:0051648,vesicle localization
2811,GO:0071810,regulation of fever generation by regulation of prostaglandin secretion
2812,GO:0046040,IMP metabolic process
2813,GO:0002858,regulation of natural killer cell mediated cytotoxicity directed against tumor cell target
2814,GO:0030100,regulation of endocytosis
2815,GO:0031049,programmed DNA elimination
2816,GO:1903747,regulation of establishment of protein localization to mitochondrion
2817,GO:0061737,leukotriene signaling pathway
2818,GO:0071826,ribonucleoprotein complex subunit organization
2819,GO:0021535,cell migration in hindbrain
2820,GO:2000481,positive regulation of cAMP-dependent protein kinase activity
2821,GO:0090662,ATP hydrolysis coupled transmembrane transport
2822,GO:0070306,lens fiber cell differentiation
2823,GO:0021957,corticospinal tract morphogenesis
2824,GO:0038034,signal transduction in absence of ligand
2825,GO:0019836,hemolysis by symbiont of host erythrocytes
2826,GO:0007506,gonadal mesoderm development
2827,GO:0002825,regulation of T-helper 1 type immune response
2828,GO:0008645,hexose transport
2829,GO:0031124,mRNA 3'-end processing
2830,GO:0018377,protein myristoylation
2831,GO:0010727,negative regulation of hydrogen peroxide metabolic process
2832,GO:0060707,trophoblast giant cell differentiation
2833,GO:0002860,positive regulation of natural killer cell mediated cytotoxicity directed against tumor cell target
2834,GO:0043616,keratinocyte proliferation
2835,GO:0033625,positive regulation of integrin activation
2836,GO:0015760,glucose-6-phosphate transport
2837,GO:0021658,rhombomere 3 morphogenesis
2838,GO:0008295,spermidine biosynthetic process
2839,GO:1903593,regulation of histamine secretion by mast cell
2840,GO:0010256,endomembrane system organization
2841,GO:0052251,induction by organism of defense response of other organism involved in symbiotic interaction
2842,GO:2000109,regulation of macrophage apoptotic process
2843,GO:0051352,negative regulation of ligase activity
2844,GO:0006665,sphingolipid metabolic process
2845,GO:0071391,cellular response to estrogen stimulus
2846,GO:0001754,eye photoreceptor cell differentiation
2847,GO:1904706,negative regulation of vascular smooth muscle cell proliferation
2848,GO:0030238,male sex determination
2849,GO:0032874,positive regulation of stress-activated MAPK cascade
2850,GO:0001738,morphogenesis of a polarized epithelium
2851,GO:0060298,positive regulation of sarcomere organization
2852,GO:0055069,zinc ion homeostasis
2853,GO:0071338,positive regulation of hair follicle cell proliferation
2854,GO:0050880,regulation of blood vessel size
2855,GO:0097102,endothelial tip cell fate specification
2856,GO:2000847,negative regulation of corticosteroid hormone secretion
2857,GO:0051443,positive regulation of ubiquitin-protein transferase activity
2858,GO:0001755,neural crest cell migration
2859,GO:0042347,negative regulation of NF-kappaB import into nucleus
2860,GO:0001516,prostaglandin biosynthetic process
2861,GO:0097272,ammonia homeostasis
2862,GO:0050910,detection of mechanical stimulus involved in sensory perception of sound
2863,GO:1902548,negative regulation of cellular response to vascular endothelial growth factor stimulus
2864,GO:0046968,peptide antigen transport
2865,GO:0032079,positive regulation of endodeoxyribonuclease activity
2866,GO:0051795,positive regulation of catagen
2867,GO:0002024,diet induced thermogenesis
2868,GO:2000742,regulation of anterior head development
2869,GO:0009608,response to symbiont
2870,GO:0006106,fumarate metabolic process
2871,GO:0032651,regulation of interleukin-1 beta production
2872,GO:0007210,serotonin receptor signaling pathway
2873,GO:0016332,establishment or maintenance of polarity of embryonic epithelium
2874,GO:0060796,regulation of transcription involved in primary germ layer cell fate commitment
2875,GO:0033693,neurofilament bundle assembly
2876,GO:0030046,parallel actin filament bundle assembly
2877,GO:0021856,hypothalamic tangential migration using cell-axon interactions
2878,GO:0070141,response to UV-A
2879,GO:0043633,polyadenylation-dependent RNA catabolic process
2880,GO:0034765,regulation of ion transmembrane transport
2881,GO:0042137,sequestering of neurotransmitter
2882,GO:0090659,walking behavior
2883,GO:1902803,regulation of synaptic vesicle transport
2884,GO:0018393,internal peptidyl-lysine acetylation
2885,GO:0010273,detoxification of copper ion
2886,GO:0072171,mesonephric tubule morphogenesis
2887,GO:0044255,cellular lipid metabolic process
2888,GO:0071698,olfactory placode development
2889,GO:0033668,negative regulation by symbiont of host apoptotic process
2890,GO:2001233,regulation of apoptotic signaling pathway
2891,GO:0015992,proton transport
2892,GO:0050690,regulation of defense response to virus by virus
2893,GO:0043487,regulation of RNA stability
2894,GO:0043931,ossification involved in bone maturation
2895,GO:0001659,temperature homeostasis
2896,GO:0070489,T cell aggregation
2897,GO:0042753,positive regulation of circadian rhythm
2898,GO:0030260,entry into host cell
2899,GO:0051205,protein insertion into membrane
2900,GO:2000852,regulation of corticosterone secretion
2901,GO:0007173,epidermal growth factor receptor signaling pathway
2902,GO:0070613,regulation of protein processing
2903,GO:0061178,regulation of insulin secretion involved in cellular response to glucose stimulus
2904,GO:0019405,alditol catabolic process
2905,GO:0014858,positive regulation of skeletal muscle cell proliferation
2906,GO:0009312,oligosaccharide biosynthetic process
2907,GO:0048739,cardiac muscle fiber development
2908,GO:2000812,regulation of barbed-end actin filament capping
2909,GO:1903298,negative regulation of hypoxia-induced intrinsic apoptotic signaling pathway
2910,GO:0003195,tricuspid valve formation
2911,GO:0060931,sinoatrial node cell development
2912,GO:0042098,T cell proliferation
2913,GO:0070537,histone H2A K63-linked deubiquitination
2914,GO:0010595,positive regulation of endothelial cell migration
2915,GO:0008584,male gonad development
2916,GO:0009609,response to symbiotic bacterium
2917,GO:0018202,peptidyl-histidine modification
2918,GO:0032495,response to muramyl dipeptide
2919,GO:2000054,negative regulation of Wnt signaling pathway involved in dorsal/ventral axis specification
2920,GO:0090467,arginine import
2921,GO:0052200,response to host defenses
2922,GO:0000188,inactivation of MAPK activity
2923,GO:0030036,actin cytoskeleton organization
2924,GO:1902017,regulation of cilium assembly
2925,GO:0002087,regulation of respiratory gaseous exchange by neurological system process
2926,GO:0010664,negative regulation of striated muscle cell apoptotic process
2927,GO:0035989,tendon development
2928,GO:0090342,regulation of cell aging
2929,GO:0015942,formate metabolic process
2930,GO:0045089,positive regulation of innate immune response
2931,GO:0032885,regulation of polysaccharide biosynthetic process
2932,GO:2000860,positive regulation of aldosterone secretion
2933,GO:1901301,regulation of cargo loading into COPII-coated vesicle
2934,GO:0031536,positive regulation of exit from mitosis
2935,GO:1904292,regulation of ERAD pathway
2936,GO:0045876,positive regulation of sister chromatid cohesion
2937,GO:0002016,regulation of blood volume by renin-angiotensin
2938,GO:0002792,negative regulation of peptide secretion
2939,GO:1902306,negative regulation of sodium ion transmembrane transport
2940,GO:0048617,embryonic foregut morphogenesis
2941,GO:2000272,negative regulation of receptor activity
2942,GO:1902512,positive regulation of apoptotic DNA fragmentation
2943,GO:0051567,histone H3-K9 methylation
2944,GO:0031104,dendrite regeneration
2945,GO:0015855,pyrimidine nucleobase transport
2946,GO:1903350,response to dopamine
2947,GO:0021679,cerebellar molecular layer development
2948,GO:0006063,uronic acid metabolic process
2949,GO:0019401,alditol biosynthetic process
2950,GO:0044458,motile cilium assembly
2951,GO:0010890,positive regulation of sequestering of triglyceride
2952,GO:0032715,negative regulation of interleukin-6 production
2953,GO:0045716,positive regulation of low-density lipoprotein particle receptor biosynthetic process
2954,GO:0009180,purine ribonucleoside diphosphate biosynthetic process
2955,GO:0006882,cellular zinc ion homeostasis
2956,GO:0051917,regulation of fibrinolysis
2957,GO:0002768,immune response-regulating cell surface receptor signaling pathway
2958,GO:1903335,regulation of vacuolar transport
2959,GO:0048619,embryonic hindgut morphogenesis
2960,GO:0014706,striated muscle tissue development
2961,GO:0002118,aggressive behavior
2962,GO:0035116,embryonic hindlimb morphogenesis
2963,GO:0071223,cellular response to lipoteichoic acid
2964,GO:2001223,negative regulation of neuron migration
2965,GO:0043171,peptide catabolic process
2966,GO:0009812,flavonoid metabolic process
2967,GO:0045956,positive regulation of calcium ion-dependent exocytosis
2968,GO:0030488,tRNA methylation
2969,GO:0072087,renal vesicle development
2970,GO:0048255,mRNA stabilization
2971,GO:1904730,negative regulation of intestinal lipid absorption
2972,GO:0051083,'de novo' cotranslational protein folding
2973,GO:0034444,regulation of plasma lipoprotein particle oxidation
2974,GO:0048008,platelet-derived growth factor receptor signaling pathway
2975,GO:0007631,feeding behavior
2976,GO:0045950,negative regulation of mitotic recombination
2977,GO:0051684,maintenance of Golgi location
2978,GO:1904293,negative regulation of ERAD pathway
2979,GO:0071345,cellular response to cytokine stimulus
2980,GO:0003174,mitral valve development
2981,GO:0021754,facial nucleus development
2982,GO:0002741,positive regulation of cytokine secretion involved in immune response
2983,GO:0046874,quinolinate metabolic process
2984,GO:2001022,positive regulation of response to DNA damage stimulus
2985,GO:1901407,regulation of phosphorylation of RNA polymerase II C-terminal domain
2986,GO:0045747,positive regulation of Notch signaling pathway
2987,GO:0002523,leukocyte migration involved in inflammatory response
2988,GO:0019265,glycine biosynthetic process, by transamination of glyoxylate
2989,GO:0003097,renal water transport
2990,GO:0034696,response to prostaglandin F
2991,GO:1903725,regulation of phospholipid metabolic process
2992,GO:0060466,activation of meiosis involved in egg activation
2993,GO:0000447,endonucleolytic cleavage in ITS1 to separate SSU-rRNA from 5.8S rRNA and LSU-rRNA from tricistronic rRNA transcript (SSU-rRNA, 5.8S rRNA, LSU-rRNA)
2994,GO:0017158,regulation of calcium ion-dependent exocytosis
2995,GO:0009636,response to toxic substance
2996,GO:0071317,cellular response to isoquinoline alkaloid
2997,GO:0086046,membrane depolarization during SA node cell action potential
2998,GO:0010522,regulation of calcium ion transport into cytosol
2999,GO:0060235,lens induction in camera-type eye
3000,GO:0045599,negative regulation of fat cell differentiation
3001,GO:0032757,positive regulation of interleukin-8 production
3002,GO:2000569,regulation of T-helper 2 cell activation
3003,GO:1901585,regulation of acid-sensing ion channel activity
3004,GO:0051437,positive regulation of ubiquitin-protein ligase activity involved in regulation of mitotic cell cycle transition
3005,GO:0003081,regulation of systemic arterial blood pressure by renin-angiotensin
3006,GO:0031064,negative regulation of histone deacetylation
3007,GO:0006797,polyphosphate metabolic process
3008,GO:1902259,regulation of delayed rectifier potassium channel activity
3009,GO:0000032,cell wall mannoprotein biosynthetic process
3010,GO:0034165,positive regulation of toll-like receptor 9 signaling pathway
3011,GO:0052547,regulation of peptidase activity
3012,GO:1901099,negative regulation of signal transduction in absence of ligand
3013,GO:1902656,calcium ion import into cytosol
3014,GO:0071393,cellular response to progesterone stimulus
3015,GO:2000307,regulation of tumor necrosis factor (ligand) superfamily member 11 production
3016,GO:2001189,negative regulation of T cell activation via T cell receptor contact with antigen bound to MHC molecule on antigen presenting cell
3017,GO:0010668,ectodermal cell differentiation
3018,GO:0006906,vesicle fusion
3019,GO:0070389,chaperone cofactor-dependent protein refolding
3020,GO:1901722,regulation of cell proliferation involved in kidney development
3021,GO:0046427,positive regulation of JAK-STAT cascade
3022,GO:0048011,neurotrophin TRK receptor signaling pathway
3023,GO:0051583,dopamine uptake involved in synaptic transmission
3024,GO:2001256,regulation of store-operated calcium entry
3025,GO:0008037,cell recognition
3026,GO:0035358,regulation of peroxisome proliferator activated receptor signaling pathway
3027,GO:0071506,cellular response to mycophenolic acid
3028,GO:1901386,negative regulation of voltage-gated calcium channel activity
3029,GO:1903975,regulation of glial cell migration
3030,GO:1902746,regulation of lens fiber cell differentiation
3031,GO:0006228,UTP biosynthetic process
3032,GO:0043270,positive regulation of ion transport
3033,GO:0042255,ribosome assembly
3034,GO:0003011,involuntary skeletal muscle contraction
3035,GO:0010803,regulation of tumor necrosis factor-mediated signaling pathway
3036,GO:0071898,regulation of estrogen receptor binding
3037,GO:0045343,regulation of MHC class I biosynthetic process
3038,GO:0021527,spinal cord association neuron differentiation
3039,GO:1902566,regulation of eosinophil activation
3040,GO:0010587,miRNA catabolic process
3041,GO:1904037,positive regulation of epithelial cell apoptotic process
3042,GO:0044034,multi-organism biosynthetic process
3043,GO:0001711,endodermal cell fate commitment
3044,GO:1904953,Wnt signaling pathway involved in midbrain dopaminergic neuron differentiation
3045,GO:0043902,positive regulation of multi-organism process
3046,GO:0051301,cell division
3047,GO:0043200,response to amino acid
3048,GO:0048741,skeletal muscle fiber development
3049,GO:0052041,negative regulation by symbiont of host programmed cell death
3050,GO:0003160,endocardium morphogenesis
3051,GO:1902969,mitotic DNA replication
3052,GO:0090271,positive regulation of fibroblast growth factor production
3053,GO:0072229,metanephric proximal convoluted tubule development
3054,GO:0030501,positive regulation of bone mineralization
3055,GO:0006378,mRNA polyadenylation
3056,GO:1902962,regulation of metalloendopeptidase activity involved in amyloid precursor protein catabolic process
3057,GO:0014015,positive regulation of gliogenesis
3058,GO:0043605,cellular amide catabolic process
3059,GO:0000278,mitotic cell cycle
3060,GO:0009082,branched-chain amino acid biosynthetic process
3061,GO:0032528,microvillus organization
3062,GO:0051875,pigment granule localization
3063,GO:0007569,cell aging
3064,GO:0045110,intermediate filament bundle assembly
3065,GO:0044805,late nucleophagy
3066,GO:2000302,positive regulation of synaptic vesicle exocytosis
3067,GO:0009182,purine deoxyribonucleoside diphosphate metabolic process
3068,GO:0006919,activation of cysteine-type endopeptidase activity involved in apoptotic process
3069,GO:0060694,regulation of cholesterol transporter activity
3070,GO:0072170,metanephric tubule development
3071,GO:0060628,regulation of ER to Golgi vesicle-mediated transport
3072,GO:0033003,regulation of mast cell activation
3073,GO:0070601,centromeric sister chromatid cohesion
3074,GO:0002635,negative regulation of germinal center formation
3075,GO:0006730,one-carbon metabolic process
3076,GO:0060453,regulation of gastric acid secretion
3077,GO:1903969,regulation of response to macrophage colony-stimulating factor
3078,GO:0019752,carboxylic acid metabolic process
3079,GO:1902460,regulation of mesenchymal stem cell proliferation
3080,GO:0042402,cellular biogenic amine catabolic process
3081,GO:0048496,maintenance of organ identity
3082,GO:1903244,positive regulation of cardiac muscle hypertrophy in response to stress
3083,GO:2000051,negative regulation of non-canonical Wnt signaling pathway
3084,GO:0032185,septin cytoskeleton organization
3085,GO:0042310,vasoconstriction
3086,GO:0022617,extracellular matrix disassembly
3087,GO:0043486,histone exchange
3088,GO:0036486,ventral trunk neural crest cell migration
3089,GO:0042214,terpene metabolic process
3090,GO:0032755,positive regulation of interleukin-6 production
3091,GO:0006621,protein retention in ER lumen
3092,GO:0042558,pteridine-containing compound metabolic process
3093,GO:0044794,positive regulation by host of viral process
3094,GO:0051932,synaptic transmission, GABAergic
3095,GO:0046881,positive regulation of follicle-stimulating hormone secretion
3096,GO:0043046,DNA methylation involved in gamete generation
3097,GO:0036500,ATF6-mediated unfolded protein response
3098,GO:0051024,positive regulation of immunoglobulin secretion
3099,GO:0009132,nucleoside diphosphate metabolic process
3100,GO:0045064,T-helper 2 cell differentiation
3101,GO:0060019,radial glial cell differentiation
3102,GO:0015698,inorganic anion transport
3103,GO:0051703,intraspecies interaction between organisms
3104,GO:0060766,negative regulation of androgen receptor signaling pathway
3105,GO:0007032,endosome organization
3106,GO:0060402,calcium ion transport into cytosol
3107,GO:0070542,response to fatty acid
3108,GO:0008344,adult locomotory behavior
3109,GO:0006749,glutathione metabolic process
3110,GO:0045649,regulation of macrophage differentiation
3111,GO:1904749,regulation of protein localization to nucleolus
3112,GO:0000470,maturation of LSU-rRNA
3113,GO:0061615,glycolytic process through fructose-6-phosphate
3114,GO:0055010,ventricular cardiac muscle tissue morphogenesis
3115,GO:1903977,positive regulation of glial cell migration
3116,GO:1903428,positive regulation of reactive oxygen species biosynthetic process
3117,GO:0034393,positive regulation of smooth muscle cell apoptotic process
3118,GO:0070874,negative regulation of glycogen metabolic process
3119,GO:0019216,regulation of lipid metabolic process
3120,GO:0080135,regulation of cellular response to stress
3121,GO:2001034,positive regulation of double-strand break repair via nonhomologous end joining
3122,GO:0033673,negative regulation of kinase activity
3123,GO:0009726,detection of endogenous stimulus
3124,GO:0038084,vascular endothelial growth factor signaling pathway
3125,GO:0002315,marginal zone B cell differentiation
3126,GO:0010875,positive regulation of cholesterol efflux
3127,GO:0031047,gene silencing by RNA
3128,GO:0051306,mitotic sister chromatid separation
3129,GO:0032534,regulation of microvillus assembly
3130,GO:2000809,positive regulation of synaptic vesicle clustering
3131,GO:0030261,chromosome condensation
3132,GO:0071404,cellular response to low-density lipoprotein particle stimulus
3133,GO:0000707,meiotic DNA recombinase assembly
3134,GO:0043243,positive regulation of protein complex disassembly
3135,GO:0036344,platelet morphogenesis
3136,GO:0048535,lymph node development
3137,GO:0046544,development of secondary male sexual characteristics
3138,GO:2001016,positive regulation of skeletal muscle cell differentiation
3139,GO:1900101,regulation of endoplasmic reticulum unfolded protein response
3140,GO:0030573,bile acid catabolic process
3141,GO:0030509,BMP signaling pathway
3142,GO:0071492,cellular response to UV-A
3143,GO:0090045,positive regulation of deacetylase activity
3144,GO:0044778,meiotic DNA integrity checkpoint
3145,GO:0090289,regulation of osteoclast proliferation
3146,GO:0030334,regulation of cell migration
3147,GO:0060969,negative regulation of gene silencing
3148,GO:0009258,10-formyltetrahydrofolate catabolic process
3149,GO:0045737,positive regulation of cyclin-dependent protein serine/threonine kinase activity
3150,GO:0045347,negative regulation of MHC class II biosynthetic process
3151,GO:2000850,negative regulation of glucocorticoid secretion
3152,GO:0042133,neurotransmitter metabolic process
3153,GO:1901563,response to camptothecin
3154,GO:0000423,macromitophagy
3155,GO:0036491,regulation of translation initiation in response to endoplasmic reticulum stress
3156,GO:0033044,regulation of chromosome organization
3157,GO:0036018,cellular response to erythropoietin
